{"api_version":"1.0","data":{"manifest_path":"/Users/example/Music/Mixes/Clients/Example Client/Projects/Example Project/00_Admin/project-manifest.json","project":{"id":"example-project","path":"/Users/example/Music/Mixes/Clients/Example Client/Projects/Example Project"},"revision":{"number":2,"path":"/Users/example/Music/Mixes/Clients/Example Client/Projects/Example Project/04_Revisions/Revision_02"},"revision_notes_path":"/Users/example/Music/Mixes/Clients/Example Client/Projects/Example Project/04_Revisions/Revision_02/Revision_Notes.md","workspace_path":"/Users/example/Music/Mixes","would_create":["/Users/example/Music/Mixes/Clients/Example Client/Projects/Example Project/04_Revisions/Revision_02","/Users/example/Music/Mixes/Clients/Example Client/Projects/Example Project/04_Revisions/Revision_02/Revision_Notes.md"],"would_update":["/Users/example/Music/Mixes/Clients/Example Client/Projects/Example Project/00_Admin/project-manifest.json"]},"errors":[],"operation":"revision.create","status":"planned","warnings":[]}
